nous poursuivrons dans cette voie et nous prendrons de les mesures supplémentaires pour encourager les nouveaux investissements , créer de nouveaux emplois , et générer la richesse nationale nécessaire pour assurer à les Canadiens un avenir stable et sûr .	we will pursue this course and take further action to encourage new investment , to create new jobs , and to generate the national wealth necessary to assure Canadians a stable and secure future .
le gouvernement continuera à faire preuve de vigilance et à gérer avec sagesse les finances de le pays .	the Government will continue to be vigilant and responsible about keeping the financial affairs of the country in order :
il se assurera que le ratio de la dette à le produit intérieur brut diminue de façon permanente .	it will put the debt - to - GDP ratio on a permanent downward track .
il équilibrera le budget à le plus tard durant le année financière 1998 - 1999 .	it will balance the budget no later than fiscal year 1998 - 99 .
il déposera de les projets de loi pour mettre en oeuvre les changements proposés à le Régime de pensions de le Canada de même que la nouvelle prestation à les aînés , afin que le Canada continue de avoir un régime public de pensions abordable à le XXIe siècle .	it will introduce legislation to implement the proposed changes to the Canada Pension Plan and the new Seniors Benefit in order to ensure Canada ' s public pension system remains sustainable in the 21 st century .
À le Canada , un emploi sur trois est tributaire de le commerce .	one in three Canadian jobs depend on trade .
notre prospérité et notre capacité de créer de les emplois sont liées à la manière dont nous savons exploiter les débouchés à le étranger .	our prosperity and our ability to create jobs are directly linked to how well we capitalize on international opportunities .
les missions commerciales de Équipe Canada ont ouvert une foule de possibilités nouvelles à les entreprises canadiennes , et démontré les mérites de la collaboration entre les gouvernements et le secteur privé .	team Canada trade missions have successfully generated new opportunities for Canadian businesses and have illustrated what we can accomplish when governments and the private sector collaborate .
le gouvernement se appuiera sur le succès de cette collaboration pour établir avec les milieux industriels une stratégie destinée à améliorer notre performance économique internationale , en élargissant notre base commerciale , et en faisant de le Canada un lieu privilégié pour les investisseurs de le monde entier et une destination touristique recherchée .	the Government will build on this success with a focussed strategy , developed in consultation with industry , to improve our international economic performance by expanding Canada ' s trade base , becoming the location of choice for global investment , and making Canada a preferred tourist destination .
le gouvernement de le Canada a regagné sa capacité de répondre à les priorités de les Canadiens sans excéder ses moyens financiers .	the Government has regained the ability to address priorities of Canadians while living within its means .
il est maintenant en mesure de effectuer de les investissements stratégiques pour nos enfants , nos jeunes , notre santé , nos collectivités , ainsi que pour le secteur de le savoir et de la créativité , tout en continuant à assainir la situation financière de le pays .	it is now in the position to make strategic investments in our children and our youth , our health , our communities , and our knowledge and creativity while continuing to improve the nation ' s finances .
le gouvernement est résolu à suivre cette approche équilibrée de investissement social et de gestion financière prudente , à le moment où il conduit le pays vers une santé économique renouvelée et durable , et une meilleure cohésion sociale .	the Government is committed to following this balanced approach of social investment and prudent financial management as it leads Canada toward renewed and lasting economic health and increased social cohesion .
notre fédération se trouve ainsi plus en mesure de répondre à les divers besoins de les Canadiens à travers le pays .	we are making the federation better able to serve the differing needs of Canadians across the country .
les Canadiens regagnent confiance en leur avenir et en celui de le pays .	Canadians feel better about their own future and the country ' s future .
ils le envisagent avec un optimisme nouveau .	we are looking to our future together with a new optimism .
le fait que nous ayons prouvé que notre pays est capable de se fixer de les objectifs ambitieux et de les atteindre nous incite à nous imposer de les objectifs encore plus élevés pour les années à venir .	the fact that we have demonstrated our ability as a country to set ambitious goals and achieve them gives us new confidence to set higher goals for the years ahead and succeed .
le défi de le avenir	our Challenge for the Future
le défi de le avenir consistera à veiller à ce que personne ne soit oublié dans la marche en avant de notre pays .	our challenge is to ensure that no Canadian is left behind as the country moves forward .
le avenir appartient à les sociétés dont le économie est saine , à celles qui investissent dans la connaissance , le éducation et le innovation ; à celles dont la population est en bonne santé , dont les enfants sont bien préparés à faire leur apprentissage , et à celles qui ont pour objectif de assurer une qualité de vie élevée à tous leurs citoyens .	the future belongs to societies whose economy is sound ; who invest in knowledge , education and innovation ; whose population is healthy ; whose children are well prepared to learn ; and who focus on securing a high quality of life for all citizens .
les Canadiens ont établi ces priorités pour cette nouvelle législature .	Canadians have already set these priorities for this new Parliament .
ces priorités sont celles de le gouvernement .	these are the Government ' s priorities .
pour un Canada plus fort	building a Stronger Canada
les gouvernements fédéral , provinciaux et territoriaux se doivent , à le égard de tous les Canadiens , de exercer un leadership responsable en faveur de le unité de le pays .	the federal , provincial and territorial governments owe it to all Canadians to take responsible leadership on the unity of the country .
le engagement le plus important de le gouvernement est de maintenir le unité de le Canada .	the single most important commitment of the Government is to keep Canada united .
il ne a pas de plus grand devoir ou responsabilité .	the Government of Canada can have no greater duty or responsibility .
À le seuil de le XXIe siècle , le objectif primordial de le gouvernement de le Canada est à la fois simple et ambitieux .	the overriding goal of the Government of Canada as we approach the 21 st century is both simple and ambitious .
il consiste à renforcer notre pays et à en assurer le unité en contribuant à le entreprise commune de faire en sorte que le Canada demeure un de les pays de le monde où il fait le mieux vivre .	it is to strengthen and unite this country by joining in the common purpose of keeping Canada one of the best places in the world in which to live .
pour que ces aspirations se réalisent pleinement , il faudra mobiliser les Canadiens de tous les horizons , ainsi que les institutions , les entreprises privées , les milieux bénévoles et les gouvernements .	realizing these aspirations fully will require the active engagement of Canadians in all walks of life , as well as our institutions , businesses , voluntary organizations and our governments .
il faudra de la collaboration et de les partenariats .	it will require collaboration and partnership .
il faudra se tendre la main .	it will require reaching out .
À le cours de leur réunion la semaine dernière , neuf premiers ministres provinciaux et les deux leaders territoriaux ont réaffirmé leur désir de collaborer plus étroitement avec le gouvernement de le Canada dans les domaines de les soins de santé et de la politique sociale .	in their meeting last week , nine Premiers and the two territorial leaders reiterated their desire for closer co - operation with the federal government in the areas of health care and social policy .
le gouvernement se réjouit de le intérêt continu de les premiers ministres et de les leaders territoriaux à travailler de concert , et il se engage à collaborer de encore plus près avec eux pour régler ces importantes questions .	the Government welcomes the Premiers ' and territorial leaders ' continuing interest in working together , and is committed to even closer collaboration on these important issues .
comme étape suivante , les premiers ministres se rencontreront cet automne pour travailler ensemble sur les questions de le chômage chez les jeunes , de les soins médicaux et de le renouvellement de la politique sociale .	as a next step , the First Ministers will meet this fall to work on co - operative approaches to address youth unemployment , health care and social policy renewal .
pour promouvoir et renforcer notre unité , le gouvernement adoptera une démarche ouverte et englobante .	the Government will take a very broad and encompassing approach to promoting and strengthening our unity .
toutes les grandes mesures que il prendra serviront à faire de le Canada un pays meilleur , et , de ce fait , plus uni .	all its major initiatives will serve to make Canada better and thus more united .
le gouvernement abordera son mandat dans un esprit de collaboration et de partenariat avec tous ses partenaires de la société canadienne .	the Government will approach its mandate committed to collaboration and partnership with all its partners in Canadian society .
le Canada nous offre un espace et de les moyens communs pour réaliser notre potentiel .	canada provides our common space and our common means for realizing our potential .
nous nous affaiblirions irrémédiablement et nous connaîtrions un changement irréversible , si nous cessions de maintenir le exemple que le Canada offre à le monde .	we would all be forever diminished , forever changed , should we fail to maintain the example Canada provides to the world .
le avenir de notre pays nous est trop précieux pour que nous risquions de le compromettre à cause de malentendus .	our future as a country is too precious for us to risk losing it through misunderstanding .
ce est pourquoi le gouvernement se assurera que tout débat visant à remettre en question le existence même de le Canada ou son unité soit franc et transparent .	therefore , the Government will bring frankness and clarity to any debate that puts into question the future existence or unity of Canada .
il se emploiera à mieux faire comprendre la complexité de tout projet de rupture et les difficultés véritables qui nous attendent si nous brisons les liens que nous avons tissés en édifiant ensemble notre nation .	it will create a better understanding of the true complexity and difficulty for all of us in severing ties that have developed in building a nation together .
et surtout , il montrera que nous pourrons accomplir beaucoup plus en demeurant ensemble que en rompant ces liens .	most of all , it will demonstrate how much more we can do together than apart .
le gouvernement travaillera de près avec les gouvernements provinciaux et territoriaux à bâtir sur ce que ont accompli les neuf premiers ministres et les leaders territoriaux la semaine dernière à Calgary , dans le but de en arriver à la pleine reconnaissance de la diversité propre à la fédération , y inclus de le caractère unique de la société québécoise .	the Government will work closely with provincial and territorial governments to further advance the progress made by nine Premiers and the territorial leaders last week in Calgary toward the full recognition of the diversity inherent in the federation , including the unique character of Quebec society .
nous nous inspirerons de le respect mutuel qui existe entre les Canadiens pour créer le avenir meilleur auquel nous aspirons tous .	we will build on the mutual respect Canadians have for one another to achieve our common aspirations for a better future .
investir dans nos enfants	investing in Children
un pays qui a décidé de investir dans ses enfants est un pays qui a foi en le avenir .	a country that has decided to invest in its children is a country that is confident in its future .
et un pays qui investit dans ses enfants aura un avenir meilleur .	a country that invests in its children successfully will have a better future .
un de nos objectifs en tant que pays devrait être de nous assurer que tout est mis en oeuvre pour permettre à tous les enfants de le Canada de réaliser leur potentiel .	one of our objectives as a country should be to ensure that all Canadian children have the best possible opportunity to develop their full potential .
nous devons tous faire en sorte que nos enfants soient capables de apprendre et de participer pleinement à la vie de la société .	we must equip our children with the capacities they need to be ready to learn and to participate fully in our society .
certes , ce sont les familles qui sont responsables , à le premier chef , de élever leurs enfants et de favoriser leur développement .	while families have the greatest responsibility in the nurturing and development of our children , they are not alone .
cela exige que le on mette le accent sur ce dont ils ont besoin pour se épanouir .	it requires focussing on what children need to thrive .
les expériences que vivent nos enfants , en particulier lorsque ils sont encore tout jeunes , ont une influence sur leur santé , sur leur bien - être , ainsi que sur leur capacité de apprentissage et de adaptation pendant toute leur vie .	the experiences of Canada ' s children , especially in the early years , influence their health , their well - being , and their ability to learn and adapt throughout their entire lives .
en investissant dès maintenant dans le bien - être de les enfants , nous améliorerons la santé à long terme de notre société .	by investing now in the well - being of today ' s children , we improve the long - term health of our society .
une de les priorités de le gouvernement est de répondre à les besoins de les familles à faible revenu qui ont de les enfants .	addressing the needs of low - income families with children is therefore a priority of the Government .
les gouvernements fédéral , provinciaux et territoriaux sont convenus de coopérer à la recherche de solutions à les problèmes de les familles à faible revenu ayant de les enfants .	federal , provincial and territorial governments have agreed to address in a co - operative way the problems of low - income families with children .
de concert , nous édifions maintenant un régime de prestation nationale pour enfants complet et efficace .	together we are now building the comprehensive and effective National Child Benefit System .
le gouvernement a déjà donné la preuve de son souci de réaliser ce projet en accroissant de 850 millions de dollars par an sa contribution à la prestation fiscale pour enfants , et les paiements majorés à les familles commenceront le 1 er juillet 1998 .	the Government has already demonstrated its initial commitment to this project by increasing its contribution to the Canada Child Tax Benefit by $ 850 million a year , with higher payments to families beginning July 1 , 1998 .
le gouvernement se emploiera avec ses partenaires provinciaux et territoriaux à établir un calendrier commun pour augmenter la contribution fédérale à la prestation fiscale pour enfants de à le moins 850 millions de dollars supplémentaires à le cours de ce mandat .	the Government will work with its provincial and territorial partners to establish jointly a common timetable for increasing the federal contribution to the Canada Child Tax Benefit by at least an additional $ 850 million during the course of this mandate .
le gouvernement travaillera également avec les provinces et les territoires à la création de un cadre national de réinvestissement qui guidera la réaffectation de les épargnes de nos partenaires à de nouveaux services et prestations à le intention de les familles à faible revenu ayant de les enfants .	the Government will also work with the provinces and territories to establish the National Re - Investment Framework to guide the re - allocation of our partners ' savings into new services and benefits for low - income families with children .
nous avons les moyens de améliorer la vie de nos enfants .	we can make a difference in the lives of all our children .
pour se épanouir et demeurer en santé , ceux - ci ont besoin que on leur consacre temps et attention ; ils ont aussi besoin de familles épanouies , de collectivités qui leur apportent soutien et sécurité .	children need a substantial investment of time and attention for healthy development ; they need strong families ; they need safe , supportive communities .
en janvier 1997 , les gouvernements fédéral , provinciaux et territoriaux ont convenu de élaborer ensemble le Programme national de le enfance , une stratégie complète destinée à améliorer le bien - être de nos enfants .	the federal , provincial and territorial governments agreed in January 1997 to work together to develop the National Children ' s Agenda , a comprehensive strategy to improve the well - being of Canada ' s children .
les gouvernements fédéral , provinciaux et territoriaux uniront leurs efforts pour élaborer ce programme élargi à le intention de les enfants , en établissant notamment de les indicateurs permettant de en juger le succès .	federal , provincial and territorial governments will work together to develop this broader agenda for children , including clear outcome measures by which to gauge success .
dans le cadre de ce programme national , le gouvernement de le Canada mettra en oeuvre trois initiatives nouvelles :	as part of this national agenda , the federal government will undertake three new initiatives :
il établira de les centres de excellence destinés à approfondir notre compréhension de le développement et de le bien - être de les enfants , et à améliorer notre capacité de répondre à leurs besoins .	it will establish Centres of Excellence to deepen our understanding of children ' s development and well - being and to improve our ability to respond to their needs .
il étendra à les réserves le programme Bon départ à le intention de les Autochtones , afin de permettre à tous les enfants autochtones de partir de le bon pied dans la vie .	it will expand our Aboriginal Head Start program onto reserves to ensure that all Aboriginal children have the opportunity to get a good start in life .
il mesurera la maturité scolaire de nos enfants et fera de les rapports périodiques qui permettront de évaluer les progrès accomplis pour leur donner les meilleures chances de départ dans la vie .	it will measure and report regularly on the readiness of Canadian children to learn , so that we can assess our progress in providing our children with the best possible start .
investir dans le domaine de la santé et de les soins de qualité	investing in Quality Care and Good Health
pourtant , les Canadiens sont de plus en plus inquiets face à la situation actuelle et à le avenir de leur régime de soins de santé .	nonetheless , there is an increasing anxiety among Canadians about the present state and the future of our medicare system .
ils se demandent se ils continueront à avoir accès à les meilleurs soins possible lorsque ils en auront besoin .	citizens worry about whether they will have access to the highest possible quality of health care when they need it .
cette inquiétude a de les causes multiples , notamment la rapidité et le ampleur de la restructuration entreprise depuis quelques années .	the anxiety arises from a number of sources , including the pace and extent of restructuring that has gone on in recent years .
le gouvernement de le Canada reconnaît que cette restructuration a été difficile pour les Canadiens . Il a donc décidé de accroître son aide financière à les provinces par rapport à les niveaux budgétés .	the federal government recognizes that this restructuring has been difficult for Canadians and , therefore , it will increase health care funding to the provinces from previously budgeted levels .
il déposera un projet de loi portant à 12,5 milliards de dollars les paiements en espèces annuels garantis , à les provinces et à les territoires , dans le cadre de le Transfert canadien en matière de santé et de programmes sociaux .	it will introduce legislation to increase to $ 12.5 billion a year the guaranteed annual cash payments to provinces and territories under the Canada Health and Social Transfer .
un de les objectifs de notre pays doit être de continuer à assurer à tous les citoyens le accès à les meilleurs soins de santé possible et de mettre à leur disposition les outils nécessaires pour jouir de une bonne santé à le seuil de le XXIe siècle .	one of our goals as a country must be to continue providing all our citizens with access to the highest possible quality of health care and the other tools they will need to enjoy healthy lives as we move into the 21 st century .
les Canadiens ont le droit de attendre de leurs gouvernements que ils collaborent dans le harmonie afin de mieux atteindre les objectifs communs de les Canadiens et de satisfaire leur désir de disposer de un meilleur régime de santé .	Canadians have a right to expect their governments to work together in harmony to better meet the shared goals and desires of Canadians for a better health system .
le gouvernement est fermement résolu à maintenir un système de soins de santé complet et administré par le secteur public , qui assurera à les Canadiens de toutes les régions de le pays un accès universel à de les soins de haute qualité .	the Government is firmly committed to a publicly administered , comprehensive health care system that provides universal access to high quality care for Canadians anywhere in the country .
le gouvernement a un rôle de premier plan à jouer pour protéger et renforcer le assurance - maladie .	the Government has a leadership role in preserving and enhancing medicare .
il a également un rôle constructif à jouer avec les provinces et les autres parties intéressées .	it has a constructive role to play as a partner with provinces and other interested parties .
il assumera ce rôle dans un esprit de ouverture , de pragmatisme et de innovation .	the Government will play that role in a spirit of openness , pragmatism and innovation .
nous pouvons prendre de les mesures pour guider les efforts de tous les gouvernements , et nous le ferons .	there are steps that we can and will take to lead the efforts by all governments .
préparer le Canada en vue de le XXIe siècle suppose notamment de nous assurer que le régime de assurance - maladie est adapté à les besoins de le avenir .	preparing Canada for the 21 st century means ensuring the medicare system meets the needs of the future .
cela veut dire répondre à les défis nouveaux .	it means responding to emerging issues in health care .
en collaboration avec ses partenaires , le gouvernement prendra les mesures suivantes :	working with its partners , the Government will undertake the following initiatives :
il appuiera les Canadiens dans leurs efforts pour répondre à les besoins croissants de soins à domicile et de soins communautaires .	it will take measures to support Canadians in responding to the expanding needs for home care and community care .
il établira un plan national , un calendrier et un cadre financier afin de assurer à la population canadienne un meilleur accès à les médicaments indispensables .	it will develop a national plan , timetable and a fiscal framework for providing Canadians with better access to medically necessary drugs .
il améliorera la qualité et le efficacité de les services de santé partout à le Canada en établissant le Fonds de transition pour les sciences de la santé afin de aider les gouvernements provinciaux à innover dans le domaine de les soins primaires , et à intégrer davantage la prestation de les services de santé et de les soins à domicile et le assurance - médicaments .	it will improve the quality and effectiveness of health services across Canada by establishing the Health Transition Fund to help the provincial governments innovate in the areas of primary care and provide more integration in the delivery of health services , home care and pharmacare .
les Canadiens reconnaissent que leur santé dépend de beaucoup plus que de les soins médicaux .	Canadians recognize that good health depends on much more than medical care .
la situation sociale et économique contribue également à déterminer la qualité de la santé .	our social and economic situations also help to determine the quality of our health .
nous devons , en tant que pays , intensifier nos efforts pour promouvoir de les modes de vie sains .	as a country , we must increase our efforts to promote healthy lives .
le gouvernement oeuvrera dans ce sens par le truchement de un programme destiné à promouvoir la santé .	the Government will contribute to this goal with an agenda to promote good health .
