chacun en lui - même est très complexe et le lien entre les deux le est encore davantage de sorte que pour beaucoup la situation présente est confuse .	each of them is very complex , but the link between the two is even more complex which makes the whole situation for most people understandably confusing .
je poursuis la lecture de les recommandations de les commissaires :	the commissionners went on :
ils sont restreints par certaines limites qui ont été fixées pour garantir que la liberté de une personne ne empiète pas sur celle de une autre .	they are constrained by limits which are imposed in order to ensure that the freedom of one person does not violate that of another .
il ne a fait que rendre légal , à toutes fins utiles , le commerce sexuel dans nos rues .	it made the buying and selling of sex on our streets legal for all intents and purposes .
le projet de loi C - 49 , de la façon dont il est présenté aujourd' hui , nous fait sentir que seules les prostituées sont punies et stigmatisées .	the way in which Bill C - 49 has been presented today gives us the feeling that only the prostitutes are punished and stigmatized .
je ne ai jamais rencontré une seule prostituée de rue qui voulait exercer un tel métier .	I never met a street hooker who wanted to be there .
le 28 juin , je ai eu le grand plaisir , avec de autres députés , de voir créer le comité permanent .	the establishment of the standing committee by unanimous consent of the House on June 28 , 1985 has already been noted .
je le ai cité comme exemple de propriété publique créatrice , dynamique et efficace .	I have stressed the CDC as an example of creative , aggressive effective public ownership .
jusque ici , près de $ 250,000 ont été octroyés par le institut en subventions à la recherche ou à de les programmes de éducation de le public .	so far , around $ 250,000 have been issued by the institute in grants for research or public education activity .
permettez - moi de conclure .	let me conclude .
il faudrait examiner sérieusement cette raison pour voir si ce est rentable ou non et si cela sert les intérêts de le public .	I think we should take a hard look at this justification to determine whether or not it is cost effective and in the public interest .
il y a lieu cependant de se interroger sur le avenir en raison de les mesures de austérité annoncées ce printemps dans le budget .	however , that raises some very pertinent questions given the cut - backs announced in the Budget last spring .
le droit de permis passe donc de $ 25 à $ 500 .	we see the licence fee going up from $ 25 to $ 500 .
il aurait été facile de dire que il faut appliquer ces sanctions à le lieu de les rendre facultatives .	it would have been easy to say that these sanctions have to be followed rather than making them voluntary .
nous devons mettre à le point de les programmes efficaces de réadaptation dans nos prisons .	we have to introduce meaningful programs for rehabilitation within our prison system .
Rendons grâce à le ciel de vivre en toute sécurité dans notre pays .	we should count our blessings that we do have a very safe country .
ils ont évidemment mobilisé de les appuis considérables à travers tout le pays .	they , of course , mobilized considerable support across the country .
la famille qui gagne $ 35,000 , lorsque le homme et la femme travaillent tous les deux , cela veut dire quoi ?	what does it mean for a family earning $ 35,000 where the husband and wife both work ?
il est donc essentiel que cette question fasse le objet de un vote aujourd' hui .	I want to make it clear that we have to let this issue come to a vote today .
le premier ministre et le cabinet ne désirent pas dépenser cet argent en Colombie - Britannique .	the Prime Minister and the Cabinet do not want to spend that money in British Columbia .
les enfants ont besoin de jouets et de loisirs .	they need toys and entertainment .
elle ne est assurément de aucune utilité à les moins nantis de notre société .	obviously it does not do one bit of good for the poor people in our society .
je crois que cela donne une bonne idée de les principes à retenir et de ce que devraient être nos responsabilités .	I think that is putting it in a very whole context as to what the principles are and what our responsibilities ought to be .
cependant , il ne a encore rien fait .	however , there is no action forthcoming .
nous aurons fait tellement de concessions que nous serons plus affaiblis que nous devrions le être .	we will have given up so much ground that we will be weaker than we need to be .
avec ce projet de loi , il sera illégal de demander à un chauffeur de taxi comment contacter une prostituée .	under this Bill it would be unlawful for a passenger in a taxi to ask a driver how to contact a prostitute .
si elles ne pouvaient pas payer leurs amendes et que personne ne venait régler leur cautionnement , elles restaient en prison .	if they could not pay their fine and no one would raise bail for them they simply stayed in .
comme vous le savez , monsieur le Président , les lois adoptées dans ces conditions - là sont souvent mauvaises .	as you are well aware , Mr. Speaker , when Governments act under political pressure , they make bad laws at times .
ce projet de loi prétend , je dis bien prétend , faire progresser le égalité de accès à le emploi .	this Bill pretends , and I say pretends , to do something about employment equity .
mais il ne y avait en fait pas de mécanisme de application obligatoire ni de méthode permettant de garantir une véritable participation de les autochtones et de les femmes .	however , there was essentially no enforcement mechanism or method of ensuring that native people and women really became involved in the process .
ils veulent de les résultats .	they want to see results .
le Conseil de le Trésor est chargé de la promotion sociale dans le administration fédérale depuis de les années , mais les femmes ne en ont guère bénéficié .	treasury Board has been responsible for affirmative action in the Government of Canada for some years now and women have little to show for it .
les travailleuses sont encore confinées à les tâches parmi les plus mal rémunérées .	women workers are still confined to most of the job ghettos .
il importe de examiner le équité professionnelle à le sein de les programmes de création de emplois fédéraux .	it is very important that we look at employment equity within the federal job - creation programs .
monsieur le Président , on a vu , hier , une autre fois , que le premier ministre ( M. Mulroney ) a trahi sa promesse .	again yesterday , Mr. Speaker , we saw the Prime Minister ( Mr. Mulroney ) break his word .
que va coûter cette décision , en manque à gagner de recettes fiscales , si elle se applique à de autres sociétés ?	what will be the cost of this particular ruling in terms of lost tax revenue as it is applied to other corporations ?
dès que le revenu de les producteurs devient insuffisant , leurs fournisseurs de matériel et de services commencent à se en ressentir dans la collectivité .	as soon as the growers begin to earn inadequate incomes , those who supply the growers and offer support services in the community begin to suffer .
2 .	2 .
2 .	2 .
oh , oh !	oh , oh !
oh , oh !	oh , oh !
oh , oh !	oh , oh !
souvenons - nous , monsieur le Orateur , que ce sont ces secteurs de notre société qui servent de épine dorsale à notre économie .	let us remember , Mr. Speaker , that these segments of our society form the backbone of our economy .
bravo !	hear , hear !
bravo !	hear , hear !
monsieur le Orateur , ma question se adresse à le ministre chargé de les transports .	Mr. Speaker , my question is directed to the Minister of Transport .
tous deux possèdent de nombreuses années de expérience dans la fabrication et la distribution de les produits forestiers .	both have many years experience in the manufacture and distribution of forest products .
1 .	1 .
je voudrais aussi parler de le droit de le fournisseur de choisir ses clients à son gré .	another point I should like to discuss is the right of the supplier to choose his customers as he sees fit .
je en ai assez de voir que les ministres semblent éprouver certains complexes à le égard de la négociation collective .	i am getting sick and tired of ministers who seem to have some hang - up with regard to the collective bargaining process .
je voudrais commenter un autre point particulier , monsieur le Orateur , avant de me taire .	there is just one specific item more that I would like to comment upon and then I will sit down , Mr. Speaker .
a le ordre .	order , please .
3 .	3 .
il ne y a pas de meilleure autorité en la matière que le député de Don Valley , non pas moi exclusivement .	i can refer him to no better authority on the subject than the hon. member for Don Valley , not just myself .
ce est tout à fait compréhensible .	it is quite understandable .
en outre , elle pourrait constituer une sérieuse menace pour la Confédération et le unité nationale .	in addition , it could become a serious threat to Confederation and national unity .
pour cette raison , nous ne avons pas cru bon de assister à la réunion et en avons informé le COJO en conséquence .	in view of this , we deemed it inadvisable to attend the meeting and so informed COJO .
monsieur le Orateur , le ministre a laissé entendre que un programme de construction plus considérable peut - être une poussée inflationniste .	Mr. Speaker , the minister suggested that a greater building program might lead to inflationary pressure .
je ne partage pas le avis de le ministre .	i disagree with the argument advanced by the minister .
il y a beaucoup à dire sur les deux aspects de cette question .	there is a lot to be said on both sides of that question .
a le ordre .	order .
monsieur le Orateur , comme je le ai signalé à le chef de le opposition , je espère faire une déclaration à ce sujet le1er novembre .	Mr. Speaker , as I indicated to the Leader of the Opposition , I would hope to make an announcement on this question on November 1 .
ce est bien cela .	quite right .
ce ne est pas en isolant quelque un que on le aide à se réadapter .	it does not bring anybody closer to rehabilitation to isolate him from the public .
il laissait une femme et une famille .	he left a wife and family .
monsieur le président je invoque le Règlement ; je suis persuadé que le député de Verdun ne aurait pas déprécié ma position .	on a point of order , Mr. Chairman , I am sure the hon. member for Verdun would not have denigrated my position .
les compagnies de assurance peuvent - elles à leur tour , agir comme compagnies aériennes ?	can the insurance industry in turn act as an airline ?
je vous le déclare , monsieur le Orateur , la population de Toronto sait que le gouvernement est incapable de fournir une réponse .	i say this to you , Mr. Speaker : the people of Toronto know the government has no answers .
on a tout à fait tenu compte de leur avis sur le état de la réserve de poisson .	their evidence on the state of each stock was taken fully into account .
je vous remercie , monsieur le Orateur , et je remercie les députés de me permettre de poursuivre .	thank you very much , Mr. Speaker , and I thank hon. members for allowing me the privilege to continue .
je réclame instamment cette étude approfondie , monsieur le Orateur , car nous ne savons presque rien de les raisons qui transforment les gens en criminels .	i urge this intensive study , Mr. Speaker , for we know so little about the reasons that turn people into criminals .
le gouvernement doit aider ses propres employés qui peuvent avoir besoin de une autre langue pour leur avancement .	the government must assist its own employees who may need another language to advance their careers .
je ne ai pas de scrupule quant à le genre de langage que je tiens .	i do not have any qualms about the type of language I use .
( la motion est adoptée . )	motion agreed to .
monsieur le président , la décision ne est pas prise à ce moment - ci , mais je imagine que ce est oui .	Mr. Speaker , no decision has been reached as yet but I should think so .
la question de les relations commerciales avec nos homologues européens devrait être envisagée très sérieusement .	the matter of trade relations with our European counterparts should be very seriously considered .
ce dont nous , les Canadiens , devons nous soucier , ce est les cas où on exporte ces animaux dans ce but - là .	what we should be concerned with in this country is the situation when these animals are shipped out of Canada for this purpose .
ils ont déjà indiqué les embranchements que ils songeaient à fermer .	they have already given an indication of the branches they intend to close .
ce ministre assurait la garde tandis que la moitié de les recettes et de les bénéfices de le industrie agricole canadienne étaient balayés par le exposé budgétaire .	this minister watched while half the proceeds and profits of the Canadian agriculture industry were swept away in a budget speech .
en aucune façon , monsieur le président .	Mr. Chairman , absolutely none .
nous en faisons actuellement le analyse et je espère que bientôt la Chambre pourra être saisie de les renseignements pertinents .	we are analysing the report now and I hope to have some information for the House in the near future .
bravo !	hear , hear !
bravo !	hear , hear !
je proposerais donc , avec le appui de le député de Halifax - East ( M. Forrestall ) :	i would therefore move , seconded by the hon. member for Dartmouth - Halifax East ( Mr. Forrestall ) :
quand on a saisi le énormité de le ravage exercé par le crime organisé dans notre pays , on doit envisager de les solutions en profondeur .	when we realize the extent of the ravages caused by organized crime in our country , we must consider deep - rooted solutions .
leur popularité a monté en flèche et ils ont traversé la crise avec facilité grâce à cela .	but oh how their popularity soared and they coasted through on that .
( 2 ) Un comité doit se en tenir à le ordre de renvoi et ne saurait y déroger .	( 2 ) A committee is bound by , and not at liberty to depart from , the order of reference .
je voudrais préciser un autre point , et je le fais parce que je estime que il se agit de un débat général .	there is one other point I should like to make , and I do so as I feel this is a general debate .
en décembre , la Colombie - Britannique a fait savoir que elle allait se retirer de le Office canadien de commercialisation de les oeufs .	in December there was an announcement that British Columbia would be withdrawing from CEMA .
bien de les députés de tous les partis de ce côté - ci de la Chambre se y sont également fortement opposés .	they have also given rise to considerable opposition by hon. members in all parties on this side of the House .
ce ne est pas de ces lignes que il faudrait se inquiéter pour le instant .	those are not the lines that one should be concerned about at this time .
le député a pu poser deux questions supplémentaires et , en toute justice , je pense que nous devrions laisser la parole à de autres députés .	i have allowed the hon. member two supplementaries and in fairness I think we should go to some other hon. members .
je crois que ce est une bonne chose .	i think that is good .
je crois que il a pris trop de temps à étudier de les demandes courantes de changements de installations le long de un pipe - line , par exemple .	i think that the time taken in handling routine applications for changes of facilities along a pipeline , for example , has been too long .
le ministre de État chargé de les Sciences et de la Technologie devrait connaître son rayon .	he is the minister who is responsible for science and technology , and he does not know .
les menuisiers de le gouvernement fédéral touchent $ 6.42 à Toronto contre $ 5.23 à Halifax et Moncton .	federal government carpenters get $ 6.42 in Toronto and $ 5.23 in Halifax and Moncton .
je aimerais mentionner à ce sujet un communiqué de presse qui a suivi la conférence fédérale - provinciale de les procureurs généraux de octobre 1975 .	for the record I would like to refer to a press release which followed the federal - provincial conference of attorneys general in October , 1975 .
monsieur le Orateur , je invoque le Règlement .	Mr. Speaker , I rise on a point of order .
je pense que le terme ferroviaire est « chargement sur demande » .	i think the railroad term is « demand loading » .
je reviendrai plus tard à ce que coûte un bâtiment de pêche de nos jours .	i will come to the cost of boats these days .
dans la plupart de les provinces , de les règlements généraux sur le bruit ont été mis en application , et dont le principe général se énonce ainsi :	in most provinces , general noise regulations have been implemented , the main principle of which is as follows :
de accord .	agreed .
après tout , le énergie est un bien collectif et le gouvernement pourrait fort bien adopter une politique de encouragement comme celle dont je ai parlé .	after all , energy is used by people throughout the nation , and the government might well consider an approach using the incentive to which I have referred .
6 .	6 .
je serai heureux , quand nous en aurons le temps , de me asseoir avec les député et de explorer la question de façon productive .	i will be glad , when we have time , to sit down with hon. members and work this matter out on a productive and prospective basis .
le ministre prendra il de les mesures pour résoudre les difficultés , car il est absolument nécessaire de passer les commandes maintenant et non dans quelques mois ?	will the minister take action to clear up any difficulties because of the absolute need for placing the orders now , and not some months from now ?
cela encouragera la construction de nouvelles embarcations de pêche et la création de nouvelles conserveries .	it will spur the construction of new fishing boats and cause new processing facilities to be built .
il y a bien de les choses que je pourrais dire à propos de le bill C - 19 .	there are many things I could say about Bill C - 19 .
je reviendrai sur cet aspect un peu plus tard , car je pense que ce est un élément que il est essentiel de souligner cet après - midi .	i am going to say something a bit later on about that because I think it is essential to the kind of debate we are having this afternoon .
les sociétés trouvent que les règlements sont compliqués , lourds et que on les modifie sans cesse .	companies find that the rules are complicated , cumbersome and changing all the time .
monsieur le Orateur , ma question se adresse à le ministre chargé de la Commission canadienne de le blé .	Mr. Speaker , my question is for the minister in charge of the Canadian Wheat Board .
si je comprends bien , on prévoit un taux de intérêts annuel de 70 % .	i understand that a rate of at least 70 per cent per annum is being contemplated .
nous souhaitons parvenir à une décision cette semaine .	it is our hope to make a decision this week .
nous acceptons votre opinion .	we accept your view .
il fit campagne là - dessus pendant les élections .	they fought an election on that position .
12 .	12 .
monsieur le Orateur , voici ce que je ai à en dire : quelle cruelle comédie , car ce est jouer la comédie .	Mr. Speaker , I say to that : what a cruel hoax , because a hoax it is .
monsieur le Orateur , nous essaierons de nous en tenir à cette suggestion .	Mr. Speaker , we will try to stick to that suggestion .
1 . a ) $ 98,355 . b ) Ils sont disponibles dans tous les grands bureaux de poste de le pays .	1 . ( a ) $ 98,355 . ( b ) They are distributed through major post offices across the country .
en vertu de la constitution , le activité criminelle est de compétence fédérale , tandis que le application de la loi relève de les provinces et de les municipalités .	crime is a national problem according to our constitution , while law enforcement is a provincial and local responsibility .
je prétends que mes remarques concernant le bill , le argent dépensé pour les soins médicaux et la façon dont on le dépense .	i submit that what I say is pertinent to the bill , to moneys being spent on medicare and the manner in which they are spent .
de abord quelques mots à le sujet de cette maladie pour vous situer .	a few words about this disease might help to put things into perspective .
heureusement , il y en a moins cette année , elles sont plus raisonnables , plus sérieuses et plus conciliantes .	fortunately they are fewer this year , more reasonable and responsible , more conciliatory .
ce projet de loi est à le étude à la Chambre depuis plus de un an .	this bill has been before the House for more than a year .
cette personne a pris sa retraite le 30 décembre 1975 après avoir complété 34 années à le service de le public .	retired December 30 , 1975 following completion of 34 years of public service .
le adoption de la motion de le député signifierait que la loi préciserait en détail les exigences de contenu et que nous pourrions les discuter .	passage of the hon. member 's motion would mean that the content requirements are spelled out in the statute and we could debate them .
cela ne veut pas dire nécessairement que il y a défaut de se y conformer de la part de les parties .	this does not necessarily indicate non - compliance on the part of the parties .
je ne lui ai pas demandé de me fournir de telles explications sur ces activités .	i was not asking for a detailed explanation as to what he was doing .
comment peut - on tant demander de une part et être assuré de si peu de le autre ?	how can so much be asked , on the one hand , and so little answered on the other ?
peut - être proposera il ensuite une mesure nouvelle et différente qui ne le exposera pas à les accusations de censure .	as a result , perhaps he will bring in different legislation which will not lay him open to the charge of censorship .
ou ils font leur travail convenablement , ou ce est à vous de obtenir le pouvoir nécessaire pour les amener à le faire .	either they do their job properly , or you must get the power so that you can be sure that they do it properly .
on y retrouve en effet toutes les tensions et toutes les divergences de notre pays .	in our national capital we have all the strains and all the divergencies of our country .
le hon. John N . Turner ( ministre de les Finances ) propose :	hon. John N . Turner ( Minister of Finance ) moved :
bien que il me coûte de le admettre , les gouvernements libéraux à le Canada ont présenté de bonnes mesures législatives ...	as much as I hate to admit it , there has been good legislation brought in by Liberal governments in this country --
en tant que député de une circonscription voisine , je connais fort bien sa persévérance et son acharnement à le travail .	as the member for the neighbouring riding I am well aware of his persistence and hard work .
où est la CAI ?	where is the AIB ?
malheureusement , à le heure actuelle , cette réalité est perçue par les deux tiers de la population non pas comme un avantage , mais comme un obstacle .	at the moment , that fact , unfortunately , is seen in two - thirds of the country not as an opportunity , but as a barrier to opportunity .
ne nous forcez pas à accepter un moratoire .	do not force a moratorium down our throats .
ce ne est pas la première fois que les députés en entendront parler .	this not the first time that members of parliament are going to hear that .
on trouvait la même recommandation dans le rapport de le 29 avril de le an dernier de le comité permanent de les privilèges et élections .	the same recommendation was made in the report of the Standing Committee on Privileges and Elections on April 29 of last year .
je crois , monsieur le président , que le ministre est mal informé .	Mr. Speaker , I am afraid the hon. member is ill informed .
dans le rapport de le ministère de les Transports sur le accident , il est dit :	in the MOT accident report it is stated :
monsieur le Orateur , le gouvernement fédéral a offert un programme de 100 millions de dollars .	Mr. Speaker , the federal offer was for a $ 100 million program .
dans la plupart de les échantillons de cette importance , ce est - à - dire un groupe de plus de 500 personnes , cela serait considéré comme négligeable .	in most samples of this size -- that is , a group of over 500 -- this would be called negligible .
de ordinaire pour demander de nouveaux pouvoirs de emprunt ou annexer un article à les bills de finances provisoires présentés à la Chambre .	the traditional procedure for seeking new borrowing powers is to attach a clause to supply bills brought before the House .
cela touche à le coeur même de notre démocratie puisque il se agit de le droit de le peuple à le information .	this strikes at the roots of democracy , and it is the right of the people to know .
cela réduirait la demande de pétrole .	this would relieve the pressure on oil .
la Division de les enquêtes spéciales a été abolie à le début de 1975 .	the Special Investigation Division has not been in existence since early 1975 .
de plus , il ne se agit pas de faire savoir si le on est pour ou contre une forme de aide à les parents adoptifs .	moreover , this is not a matter of saying whether we are for or against some sort of assistance for adoptive parents .
montrez - nous les documents .	let us see the documents .
